[
  {
    "schema_version": "1.0",
    "event_version": 1,
    "event_id": "evt_20260707_0001",
    "event_type": "revocation.triggered",
    "timestamp_utc": "2026-07-07T10:00:00Z",
    "tenant_id": "tenant_alpha",
    "user_id": "user_123",
    "namespace": "story_state",
    "severity": "sev2",
    "status": "active",
    "source_system": "revocation_controller",
    "reason": "permission_revoked",
    "scope": ["story:read", "summary:read"],
    "policy_version": "policy_1",
    "model_version": "model_1",
    "invalidation_action": "invalidate_scope",
    "artifact_ref": "artifacts/revocation_0001.json",
    "correlation_id": "inc_20260707_alpha_001",
    "group_key": "tenant:tenant_alpha:severity:sev2",
    "partition_id": "l99_partition_alpha_story_state",
    "revocation_epoch": 8
  },
  {
    "schema_version": "1.0",
    "event_version": 1,
    "event_id": "evt_20260707_0002",
    "event_type": "cache.partition_invalidated",
    "timestamp_utc": "2026-07-07T10:00:05Z",
    "tenant_id": "tenant_alpha",
    "namespace": "story_state",
    "severity": "sev2",
    "status": "completed",
    "source_system": "cache_controller",
    "reason": "revocation_epoch_bumped",
    "invalidation_action": "partition_flush",
    "artifact_ref": "artifacts/invalidation_0001.json",
    "correlation_id": "inc_20260707_alpha_001",
    "group_key": "tenant:tenant_alpha:severity:sev2",
    "partition_id": "l99_partition_alpha_story_state",
    "revocation_epoch": 8
  },
  {
    "schema_version": "1.0",
    "event_version": 1,
    "event_id": "evt_20260707_0003",
    "event_type": "promotion.blocked",
    "timestamp_utc": "2026-07-07T10:00:10Z",
    "tenant_id": "tenant_alpha",
    "namespace": "story_state",
    "severity": "sev2",
    "status": "blocked",
    "source_system": "promotion_controller",
    "reason": "shadow_validation_required_after_revocation",
    "promotion_action": "block_until_shadow_pass",
    "artifact_ref": "artifacts/promotion_gate_0001.json",
    "correlation_id": "inc_20260707_alpha_001",
    "group_key": "tenant:tenant_alpha:severity:sev2",
    "partition_id": "l99_partition_alpha_story_state",
    "revocation_epoch": 8
  },
  {
    "schema_version": "1.0",
    "event_version": 1,
    "event_id": "evt_20260707_0004",
    "event_type": "poisoning.suspected",
    "timestamp_utc": "2026-07-07T10:05:00Z",
    "tenant_id": "tenant_beta",
    "namespace": "continuity_bundle",
    "severity": "sev3",
    "status": "active",
    "source_system": "redteam_monitor",
    "reason": "contamination_ratio_exceeded",
    "artifact_ref": "artifacts/poisoning_0001.json",
    "correlation_id": "inc_20260707_beta_001",
    "group_key": "tenant:tenant_beta:severity:sev3",
    "partition_id": "l99_partition_beta_continuity",
    "metadata": {
      "critical_bucket": true
    }
  },
  {
    "schema_version": "1.0",
    "event_version": 1,
    "event_id": "evt_20260707_0005",
    "event_type": "containment.started",
    "timestamp_utc": "2026-07-07T10:05:03Z",
    "tenant_id": "tenant_beta",
    "namespace": "continuity_bundle",
    "severity": "sev3",
    "status": "blocked",
    "source_system": "incident_controller",
    "reason": "poisoning_suspected",
    "invalidation_action": "disable_semantic_hits_and_flush_partition",
    "artifact_ref": "artifacts/containment_0001.json",
    "correlation_id": "inc_20260707_beta_001",
    "group_key": "tenant:tenant_beta:severity:sev3",
    "partition_id": "l99_partition_beta_continuity",
    "metadata": {
      "critical_bucket": true
    }
  }
]
